Pemilihan Umum Serentak Pemilu Tahun 2024 Masehi,b'pemilu untuk memilih apa saja'
isman sandira,"b'@senzJhonsen25 @arifinpordjo1 @Ikhw4Ikhwan @akbarfaizal68 @NasDem @DppPKS @PartaiDemokrat @Fahrihamzah Aher masih menjual ya, momennya udah habis, harusnya mereka ngotot di pemilu kemarin'"
VivaCoid,"b'Jelang Pemilu 2024, Oso ke Kader Hanura: Kalian Harus Rebut Hati Rakyat! https://t.co/RgYBZt2z0r'"
ukmuna,b'RT @bachrum_achmadi: Gayanya sik TV kudu digital. Cmentara kotak suara pemilu dr kardus digempok.\n\nKan katrok! \xf0\x9f\xa4\xa3\xf0\x9f\xa4\xa3\xf0\x9f\xa4\xa3'
PEMIMPIN ADIL,"b'RT @CNNIndonesia: Sebut Pemilu 2024 Kompleks, Bawaslu Usul Pengawas TPS Ditambah https://t.co/tTnxocV6sq'"
deny,b'RT @keuangannews_id: Pemerhati Politik dan Sosial: Kecurangan Pemilu Diawali dari Rilis Lembaga Survei dan\xc2\xa0Buzzer! https://t.co/oeyilOf3HW'
#IdiotPresidentNoMore,"b'RT @papa_loren: PSI Belum Penuhi Syarat Pemilu 2024. Sedih jg ya klo sampe ngga LOLOS, ntar nyari yg lucu dimana? \xf0\x9f\x99\x88 https://t.co/XjgUyGTFhw'"
CNN Indonesia,"b'Sebut Pemilu 2024 Kompleks, Bawaslu Usul Pengawas TPS Ditambah https://t.co/tTnxocV6sq'"
KOMPAS TV,b'Rakor Sentra Gakkumdu Kalsel Waspadai Modus-Modus Baru Tindak Pidana Pelanggaran Pemilu 2024 https://t.co/WS8I3D3ylH https://t.co/ar6ajoO8IT'
Ceblak Idiot,"b'RT @papa_loren: PSI Belum Penuhi Syarat Pemilu 2024. Sedih jg ya klo sampe ngga LOLOS, ntar nyari yg lucu dimana? \xf0\x9f\x99\x88 https://t.co/XjgUyGTFhw'"
TanpaKehendak,"b'@WagimanDeep212_ @gibran_tweet Sejarahnya  pemilu lalu, tiba tiba calon wakilnya diluar jauh... \xf0\x9f\xa4\xa3\xf0\x9f\xa4\xa3 Hnya meniru masa lalu bukan suatu terobosan baru. Nb : wakil presiden saat ini.'"
deny,b'RT @ShamsiAli2: https://t.co/Se7Kz47zv3'
²³ bissmillah eligible,"b'@Askrlfess menurut ku si karena sekarang banyak yang berkiblat pada korea (misal fashion, makanan, make up, dll) trus dia emang sengaja ambil hati orang\xc2\xb2 pecinta korea utk keperluan pemilu. kita harus lebih cerdas yh guys, jangan tergiur sama gitu2an'"
Abdul Karim,b'RT @GerakAnies: Partai Nasdem akan jadi pemenang Pemilu 2024 karena mencalonkan Anies Rasyid Baswedan sebagai Calon Presiden RI 2024?\n\nYang\xe2\x80\xa6'
🪲tet tot tet tot 🐞,"b'@KompasTV Pendaftaran capres &amp; cawapres masih lama, tapi CEBONG udah gak sabar pengen buru2 dapat kabar klo Anies gagal nyapres biar jagoannya CEBONG gak ada lawan berat di pemilu 2024.'"
Paman Nahrasa,"b'@JulBayur3 Basi, nggak punya bahan lg yah Bong? Tiap menjelang pemilu ISU YG LO JUAL HILAFAH, RADIKAL, INTOLERAN, TERORIS, sampai sekarang Lo hidup di tengah"" masyarakat Islam, dan nggak ada orang Kristen yg di bunuh oleh orang Islam, Aman kan???'"
Achmad Farid,"b'@keuangannews_id Disaat hampir mau menuju ke pemilu, kenapa selalu kabar ttg keburukan bapak @aniesbaswedan santer terdengar?? Jika fitnah ini terus dilancarkan maka kami makin mantab akan memilih beliau'"
Karjani,b'@JulBayur3 Keluar lagi mau pemilu....BASI'
detikcom,"b'Dua hari berlalu sejak pemilu sela digelar di AS, namun hasil akhir soal suara mayoritas dalam Kongres, terdiri atas DPR dan Senat, masih belum bisa diketahui. https://t.co/Dhzynnv2iP'"
Pemilihan Umum Serentak Pemilu Tahun 2024 Masehi,b'untuk memilih pemilu'
Su.Su.Sa SukasukaSaya,"b'RT @bd_baskoro: I fully agree with FH statement ""bandar belum deal"" \nbut many too ""polos"" to follow the game &amp; not take a lesson every 5 ye\xe2\x80\xa6'"
🗿📈Unreal📉🗿,"b'@asumsico Biasa mendekati pemilu kebanyakan pencitraan, maklum di negeri sendiri tidak laku \xf0\x9f\x98\x8f'"
Qomaruddin Hasan,b'yang ngk baik memang sejenis hantu-hantu https://t.co/vl8oPCr6oQ'
Mantan Professor,b'RT @keuangannews_id: Pemerhati Politik dan Sosial: Kecurangan Pemilu Diawali dari Rilis Lembaga Survei dan\xc2\xa0Buzzer! https://t.co/oeyilOf3HW'
Aksialfatih,"b'RT @papa_loren: PSI Belum Penuhi Syarat Pemilu 2024. Sedih jg ya klo sampe ngga LOLOS, ntar nyari yg lucu dimana? \xf0\x9f\x99\x88 https://t.co/XjgUyGTFhw'"
Blackco Tanya,"b""Koalisi perubahan adalah politik  dagang sapi, memilihnya berdasarkan kepentingan sapi bukan kepentingan rakyat. \n\nFahri Hamzah melontarkan kritiknya soal pembicaraan capres dan cawapres yang digodok 'Koalisi Perubahan' besutan NasDem, Demokrat, dan PKS.\n\n https://t.co/Pyab5lLtOP"""
Jul,"b'@grrrrhhhhha @Rnasr_stdy @frztmr @thepanturas Jd klo menang pemilu krn fans korea\xc2\xb2an? Pemikirian mcm apa itu. Malesin bgt haha \xf0\x9f\xa4\xa7\nJls kubu dia dulu menang pemilu bkn krn fans korea\xc2\xb2an.\nLagian PAN yg kmrn terang\xc2\xb2an bawa idol kpop ke Istora Senayan jg jd perdebatan noh, yg nonton jg bukan demi PAN, ya demi idolnya aja. Ga bgt.'"
Pemilihan Umum Serentak Pemilu Tahun 2024 Masehi,b'apa itu logistik pemilu'
Yauda Sih,b'Pilih orang2 yg peduli ke rakyat kecil bukan cuma pas mau pemilu aja. #KaloAdaSih'
Alfian Firmansyah,b'RT @keuangannews_id: Pemerhati Politik dan Sosial: Kecurangan Pemilu Diawali dari Rilis Lembaga Survei dan\xc2\xa0Buzzer! https://t.co/oeyilOf3HW'
Sumarnis,b'@smartman1971 @anakangsa54 @aniesbaswedan Untung pemilu gak diadakan hari ini...berarti nanti 2024 kami akan menang lagi seperti 2014-2019...kejang2 lagi tuh kampret bin kadrun...!!!'
planga' plongok,"b'RT @alisyarief: Ketum Muhammadiyah: Negara Jangan Ikut Terlibat Kontestasi Pemilu 2024, Sindir Siapa? https://t.co/qMxGqR1XN1'"
Ngaciro mole,b'RT @DjokedA: https://t.co/OBQLMmHWOH'
bebrayan,"b'@Adon32279227 @gagal_hijrah HTI itu tidak pernah ikut pemilu krn haramkan demokrasi, terus hubungan dia sama partai oposisi itu apa? \n\nKlo pki sudah jelas mau ganti Pancasila dengan Komunis, kyk PDI-P juga mau ganti Pancasila dg trisila dan ekasila'"
Bagindo,"b'RT @papa_loren: PSI Belum Penuhi Syarat Pemilu 2024. Sedih jg ya klo sampe ngga LOLOS, ntar nyari yg lucu dimana? \xf0\x9f\x99\x88 https://t.co/XjgUyGTFhw'"
Andarisq8,"b'RT @papa_loren: PSI Belum Penuhi Syarat Pemilu 2024. Sedih jg ya klo sampe ngga LOLOS, ntar nyari yg lucu dimana? \xf0\x9f\x99\x88 https://t.co/XjgUyGTFhw'"
Agus Dimyati,"b'RT @papa_loren: PSI Belum Penuhi Syarat Pemilu 2024. Sedih jg ya klo sampe ngga LOLOS, ntar nyari yg lucu dimana? \xf0\x9f\x99\x88 https://t.co/XjgUyGTFhw'"
ｋｉｋｉ ｓｅｔｉａｗａｎ,"b'@fadlizon @jokowi @prabowo kepentingan rakyat di atas segalanya\nkekayaan alam yg tidak ternilai rusak\nsangat menghawatirkan\njadi butuh orang di luar oligarki\nyg cinta tanah air nya\nklo cuma teken proposal gak usah pemilu jadikan saja siapapun bisa klo cuma\npungut pajak jual/sewa aset,mineral dan utang.'"
Kaos AGMK siap!,"b""RT @SartonoHutomo: Andi Arief Singgung 'Burung Hantu' Ingin Koalisi Perubahan Pisah, Siapa? https://t.co/1uqW3UwzDk"""
Coltliq Ekajaya,b'Bawaslu Luncurkan Sistem Informasi Penyelesaian Sengketa Pemilu Versi 3.0 https://t.co/QZiBQ5ZjsB'
loli🍭,b'kpopers or any korean things lovers tiati yaaa jangan kepancing:( \n\nkalian targetnya nih menjelang pemilu piw piw https://t.co/dcYVF9Zswk'
BabeGoak,b'@Subur0204 Sebaiknya sampah gausah ikut Pemilu.'
Blackco Tanya,b'Ketum Projo Budi Arie Setiadi menyebut nama Prabowo mulai menonjol di Musra Relawan Jokowi. Budi Arie menyebut masyarakat ingin Prabowo jadi penerus Jokowi.\n\n https://t.co/LlgQuWNjwn'
Blackco Tanya,b'Ketua Umum Projo Budi Arie Setiadi mengaku siap mendukung Prabowo sebagai calon presiden. Hal itu akan dilakukan bila Presiden Jokowi juga mendukung Prabowo.\n\n https://t.co/TXRZUuHe6q'
Saauliadani 🐹🌙,b'@phumpipurit @moch_fahmiii @detikcom Tapi inshaaAllah kpopers Indonesia yang punya hak suara di pemilu pinter2 semua kok kak'
Pemilihan Umum Serentak Pemilu Tahun 2024 Masehi,b'apa itu pemilu langsung'
Cerita AHY,b'Kader Partai Demokrat Aceh\xc2\xa0Besar menyatakan siap memenangkan Partai Demokrat dan Agus Harimurti Yudhoyono (AHY) sebagai Presiden di Pemilu\xc2\xa02024.'
jiminyul,b'Keknya kalau pemilu nanti anis baswedan nyalon w nyoblos si doi dah kayak e'
Nathan Ardhani,"b'Gerindra, kata Muzani, mendapatkan dukungan besar dari Presiden Jokowi tersebut sebagai bentuk pemecut semangat agar menang dalam pemilu 2024. Mending Prabowo https://t.co/0gU0ZNy9rp dekade08'"
Waiting List.,"b'RT @ramang_at: @Askrlfess Kpopers tanya, hubungannya sama kpopers apa? Begini ya dek adek, dia mau nyari suara kalian di pemilu nanti'"
Setyo Utomo,"b'RT @alisyarief: Ketum Muhammadiyah: Negara Jangan Ikut Terlibat Kontestasi Pemilu 2024, Sindir Siapa? https://t.co/qMxGqR1XN1'"
Blackco Tanya,"b'\xf0\x9f\x98\x82\xf0\x9f\x98\x82\xf0\x9f\x98\x82ngarep banget jd cawapres.\n\nPartai Demokrat mengaku tidak masalah tak diundang dalam perayaan HUT ke-11 Partai NasDem. Menurutnya, perayaan tersebut merupakan acara internal Partai NasDem.\n\n https://t.co/6M1S7dUEQR'"
UGM_FESS,"b'ugm_fess ini udah mulai masa kampanye dan pemilu presma??? anjir kok ngerasa cepet amat dan ga kerasa dampak apa"" tahun"" sebelumnya'"
iqbal fanshuri,"b'Gerindra, kata Muzani, mendapatkan dukungan besar dari Presiden Jokowi tersebut sebagai bentuk pemecut semangat agar menang dalam pemilu 2024. Mending Prabowo https://t.co/r3J9EFlEfG dekade08'"
Alwi Tjandra,b'Satu lagi pemilu itu BUKAN UNTUK MENCARI ORANG BAIK TAPI MENCEGAH ORANG JAHAT BERKUASAAA https://t.co/P9D87FqR2D'
Kebenaran Akan Datang Bila Sudah waktunya,"b'RT @FPKSDPRRI: Kalo Kamu Pilih PKS \nDi Pemilu Tanggal 14 Februari 2024 \nBoleh likes, share and RT\nLAMBANG BARU PKS \xf0\x9f\x91\x87\n\nVOTE https://t.co/qzx\xe2\x80\xa6'"
Pemilihan Umum Serentak Pemilu Tahun 2024 Masehi,b'apa itu pemilu legislatif'
Joko Boyo,"b'RT @papa_loren: PSI Belum Penuhi Syarat Pemilu 2024. Sedih jg ya klo sampe ngga LOLOS, ntar nyari yg lucu dimana? \xf0\x9f\x99\x88 https://t.co/XjgUyGTFhw'"
Blackco Tanya,b'Seperti Maling teriak Maling.\n\nSekjen PDIP Hasto Kristiyanto menduga burung hantu yang dimaksud Andi Arief ada di koalisi perubahan. Burung hantu itu menggagalkan deklarasi PD-PKS-NasDem.\n\n https://t.co/iGixt7lTaS'
Bawaslu Kota Samarinda,"b'Rapat Koordinasi Fasilitasi Penanganan Temuan dan Laporan Pelanggaran Bersama Panwaslu Kecamatan se- Kota Samarinda Pada Pemilu Tahun 2024, bertempat di Ballroom Aston Hotel &amp; Convention Center, 9 - 10 November 2022.\n#pemilu2024 \n#ayoawasibersama \n#cegaawasitindak https://t.co/sglP779g2A'"
Kompasiana,b'Gunakan Teknik Pemasaran Digital Seperti Ini Jika Ingin Terpilih Pemilu Legislatif 2019 https://t.co/Wbbjq8mpSx'
Uus Bustami,"b'PAN dan PKB mengajak PKS untuk bergabung dalam 2 koalisi yang sudah mereka bentuk. Namun, PKS menyatakan masih erat dengan NasDem dan Demokrat.\n\n https://t.co/vSm3gPh5kW'"
Info Pemilu,"b'Adhyaksa Research and Consulting (ARC), menang pemilu/Pemilukada tak harus mahal. CP 08114134165 (Marses)'"
pian pin,"b'@KucengTerbanggg Terakhir ketemu pemilu jaman SBY bapak gw nanya mau beli mainan apa, sampe sekarang gak ketemu lagi'"
Vania Safirah,"b'Gerindra, kata Muzani, mendapatkan dukungan besar dari Presiden Jokowi tersebut sebagai bentuk pemecut semangat agar menang dalam pemilu 2024. Mending Prabowo https://t.co/bN7qRfq60b dekade08'"
Mang Ato,"b'@VIVAcoid Kalau ikutan apa nggak malu ya?\nJelang pemilu banyak ulama dibantai, katanya oleh orang gila. Kasusnya ditutup.\n6 orang meninggal entah dimana meninggalnya, belum menerima keadilan.\nSemua dialihkan ke pengadilan akhirat.'"
mukidi raja bohong,b'@JulBayur3 Keluar setiap mau pemilu.dobol pembohong'
Azis Yaah,b'@republikaonline jatah ? emg gada pemilu ?'
Niko Rudiana,"b'Gerindra, kata Muzani, mendapatkan dukungan besar dari Presiden Jokowi tersebut sebagai bentuk pemecut semangat agar menang dalam pemilu 2024. Mending Prabowo https://t.co/x6zDXAOKtC dekade08'"
tikushitam,b'RT @ORakyat4: Sulapan pemilu Indonesia \nSimsalabim abrakadabra https://t.co/x0wLihr02f'
Luthor's Archieve,b'Wkwkwk 459 hari sebelum pemilu ada aja dagelan https://t.co/PPIv6dOq5b'
Graaahh,b'@Rnasr_stdy @frztmr @thepanturas yakin pada bodoamat? \xf0\x9f\xa4\xad\nntar tiba tiba menang pemilu'
Shafi Batw,b'https://t.co/UlAGxYcIZ4'
Fatih Abdul,b'https://t.co/hvDadrs9Cl'
Mama-Dika,"b'RT @CutSarina5: Mau pemilu pada berubah wujud untuk mengambil hati rakyat ,ada pasang wajah wong deso,ada yang drama merakyat entah apa  la\xe2\x80\xa6'"
BJORKA,"b'@fadlizon @jokowi @prabowo Dulu sy dan keluarga besar berkorban harta, waktu selama 2 kali pemilu mendukung PS08, PEMILU kali ini kami sudah bertekad memperbaiki INDONESIA dgn mendukung dan memilih Bapak Anies Baswedan. #AniesForPresidenRI2024'"
Uus Bustami,"b'Partai Demokrat mengaku tidak masalah tak diundang dalam perayaan HUT ke-11 Partai NasDem. Menurutnya, perayaan tersebut merupakan acara internal Partai NasDem.\n\n https://t.co/J9GRkPqAwl'"
aliapong,"b'@Ffachmi_Jo1 @detikcom Tapi coba tanya nyokap bokap lu, ato orang2 yg udah 50taon keatas... Mereka cuma taunya 3 parte! Angel lurd... \nPaling simpel,kl pas pemilu ambil duitnya coblos yg laen, ksh ngasih duit semua ya coblos semua\xf0\x9f\xa4\xa3\nDilema kl makelarnya orang deket, duit diambil suara ga nongol wkwkwk'"
T,"b'RT @papa_loren: PSI Belum Penuhi Syarat Pemilu 2024. Sedih jg ya klo sampe ngga LOLOS, ntar nyari yg lucu dimana? \xf0\x9f\x99\x88 https://t.co/XjgUyGTFhw'"
cut arfina,"b'Gerindra, kata Muzani, mendapatkan dukungan besar dari Presiden Jokowi tersebut sebagai bentuk pemecut semangat agar menang dalam pemilu 2024. Mending Prabowo https://t.co/lzLzrAwkvA dekade08'"
Daeng Abang 🇮🇩🇵🇸,b'RT @OposisiCerdas: Pemerhati Politik dan Sosial: Kecurangan Pemilu Diawali dari Rilis Lembaga Survei &amp; Buzzer\nhttps://t.co/mFBNfqTxbf'
Pemilihan Umum Serentak Pemilu Tahun 2024 Masehi,b'untuk apa pemilu kenapa'
Zainal Arifin,"b'RT @Dennysiregar7: Wahh piye iki.. Kalau ga jadi deklarasi, posisi Anies bisa bahaya \xf0\x9f\xa4\xad\n\nhttps://t.co/RNRbAj6vGF'"
Del 📚,b'Tapi ternyata entah bisikan apa yang diberikan Soeharto kepada petinggi ABRI hingga akhirnya dalam sebuah rapat rahasia disetujui bajwa ABRI sepenuhnya Golkar dan bagian dari keluarga Golkar. \n\nHingga akhirnya ABRI membantu Golkar memenangkan pemilu kembali pada tahun 1982.'
"waspada manusia munafik=bicara tdk konsisten,🤪🤪,","b'RT @papa_loren: PSI Belum Penuhi Syarat Pemilu 2024. Sedih jg ya klo sampe ngga LOLOS, ntar nyari yg lucu dimana? \xf0\x9f\x99\x88 https://t.co/XjgUyGTFhw'"
the king of lip service,b'RT @ShamsiAli2: https://t.co/Se7Kz47zv3'
Om Den,b'@03__nakula Baru pemilu kali ini presiden nya vulgar berusaha jadi king maker. Sampe kasih jatah restu segala. Hebat. Etis sekali. Demokratis sekali.'
gabriello sadewa.,b'@hongbihongsi PEMILU MASIH 2024 PLIS???????'
Uus Bustami,b'Sekjen PDIP Hasto Kristiyanto menduga burung hantu yang dimaksud Andi Arief ada di koalisi perubahan. Burung hantu itu menggagalkan deklarasi PD-PKS-NasDem.\n\n https://t.co/Kgou9YJWvX'
INDONESIA TANPA PDIP !!!,"b'RT @AndiSinulingga: Jika jabatan presiden itu seperti kerajaan (milik sendiri), maka sang raja bisa mewariskan pada siapa yg dia mau.\n\n""Sem\xe2\x80\xa6'"
.,b'@keuangannews_id Emak2 yang ngerasa dikhianati pasti ga nyoblos partai @Gerindra pada saat pemilu 2019 kemarin.'
Rizki Siagian,b'RT @keuangannews_id: Pemerhati Politik dan Sosial: Kecurangan Pemilu Diawali dari Rilis Lembaga Survei dan\xc2\xa0Buzzer! https://t.co/oeyilOf3HW'
NO JIL,"b'RT @kenjironagasak1: @detikcom Kanjuruhan gak masuk itungan mereka,  PEMILU BESOK JANGAN PERNAH PILIH PDI PERJUWANGAN ... INGAT ITU  ..\n SU\xe2\x80\xa6'"
Hari I Pristiwanto,"b'RT @BudiRaynor: @geloraco (PS - GP)  Vs  (Anies - Sandal Jepit Butut Sebelah Merah Sebelah Ijo),\nmasih menang pasangan Anies asal pemilu jg\xe2\x80\xa6'"
Orion,"b'lucu bgt hasil rakit rakit nya cwk ak @inigabriello tlong kembangkan bakat mu yyh dik, nnti ak ksih kmu sun and hug yang banyak and lama sampe pemilu https://t.co/H9gUcEa7zK'"
istiqomah itu sangat berat,b'Ntar pas ud mo pemilu.. Datang https://t.co/b5J8eMSjCM'
Ariyadhi Nugraha,b'@BarraKusnadi @Midjan_La_2 Karena mau pemilu mas hrus siap cari berita yg baik2 walau bebanin Rakyat dan pekerjannya biar bsa maju lgi terlihat jelas senyum diwajah bapak2 pejabat'
Dewo,"b'RT @papa_loren: PSI Belum Penuhi Syarat Pemilu 2024. Sedih jg ya klo sampe ngga LOLOS, ntar nyari yg lucu dimana? \xf0\x9f\x99\x88 https://t.co/XjgUyGTFhw'"
KPU Kabupaten Lampung Timur,b'2.. Pastikan tidak terdaftar di parpol cek di https://t.co/3ajPdKxea6\n\nUntuk informasi selanjutnya ikuti terus Media Sosial KPU Kabupaten Lampung Timur agar tidak ketinggalan infonya ya!!!\n\n#KPUMelayani\n#PemiluSerentak2024\n#KPURI\n#KPUProvinsiLampung'
Panwascam Tonjong,b'RT @BawasluBrebes: Guna mewujudkan Pemilu tahun 2024 yang bermartabat Badan Pengawas Pemilu Kabupaten Brebes menggelar Sosialisasi Pengawas\xe2\x80\xa6'
Bhisma Tiwikrama,b'RT @yo2thok: Berita Kherson aneh. Rusia mengatakan mereka mundur. Ukraina mengatakan Rusia tidak menarik diri. Perancis mengatakan mereka t\xe2\x80\xa6'
Leo Abithama Bramantya,b'@azkafii @CNNIndonesia https://t.co/bpW5gCD9tz'
EndahMutiara1277,b'@mohmahfudmd Anda bicara dengan siapa? Udah untung di angkat Mentri tanpa mendukung...!Emang iya mencari menang dalam pemilu setelah menang baru mencari benar!'
gaTuso,"b'RT @alisyarief: Ketum Muhammadiyah: Negara Jangan Ikut Terlibat Kontestasi Pemilu 2024, Sindir Siapa? https://t.co/qMxGqR1XN1'"
Alon-alon Mas,b'RT @keuangannews_id: Pemerhati Politik dan Sosial: Kecurangan Pemilu Diawali dari Rilis Lembaga Survei dan\xc2\xa0Buzzer! https://t.co/oeyilOf3HW'
Banksters are MONSTERs,b'@henrysubiakto https://t.co/ku3xoS9o8Q'
Ketupat,"b'RT @CutSarina5: Mau pemilu pada berubah wujud untuk mengambil hati rakyat ,ada pasang wajah wong deso,ada yang drama merakyat entah apa  la\xe2\x80\xa6'"
Boyka,"b'RT @papa_loren: PSI Belum Penuhi Syarat Pemilu 2024. Sedih jg ya klo sampe ngga LOLOS, ntar nyari yg lucu dimana? \xf0\x9f\x99\x88 https://t.co/XjgUyGTFhw'"
Ketupat,"b'RT @bd_baskoro: I fully agree with FH statement ""bandar belum deal"" \nbut many too ""polos"" to follow the game &amp; not take a lesson every 5 ye\xe2\x80\xa6'"
ꦕꦃꦪꦺꦴ,"b'@CNNIndonesia mau model kayak apapun, pemilu sll dituduh tidak jurdil...  curang, dll.\n\xf0\x9f\x98\xb9\xf0\x9f\x98\xb9\xf0\x9f\x98\xb9\xf0\x9f\x98\xb9'"
🌠Nr H7N🌟🌠,b'RT @virza1: @J0kerWedok @ex_AnakLolina https://t.co/SPCnozWHtZ'
Meong,"b'RT @papa_loren: PSI Belum Penuhi Syarat Pemilu 2024. Sedih jg ya klo sampe ngga LOLOS, ntar nyari yg lucu dimana? \xf0\x9f\x99\x88 https://t.co/XjgUyGTFhw'"
Andrizal Abu zaki,"b'RT @papa_loren: PSI Belum Penuhi Syarat Pemilu 2024. Sedih jg ya klo sampe ngga LOLOS, ntar nyari yg lucu dimana? \xf0\x9f\x99\x88 https://t.co/XjgUyGTFhw'"
hasibuan ucok,"b'RT @CutSarina5: Mau pemilu pada berubah wujud untuk mengambil hati rakyat ,ada pasang wajah wong deso,ada yang drama merakyat entah apa  la\xe2\x80\xa6'"
tukang bangunan,b'....palagi proyek psn ngejar pemilu jd percepatan tapi ownernya rese rs ksnya gabisa ngapa ngapain dan staffnya dikit'
durian langit,"b'@papa_loren Wah,  jgn sampe gak ikut pemilu donk, gak ada kamu perpolitikan ibarat makan rendang sambal tanpa terasi'"
Yudianto,"b'RT @papa_loren: PSI Belum Penuhi Syarat Pemilu 2024. Sedih jg ya klo sampe ngga LOLOS, ntar nyari yg lucu dimana? \xf0\x9f\x99\x88 https://t.co/XjgUyGTFhw'"
Nongrahma,b'RT @cakimiNOW: Cak Imin Dukung Arahan Jokowi Agar Partai-partai Saling Puji https://t.co/g692yjOb1b'
Agung Trianto,"b'Jika data diri kita semua tidak benar-benar dilindungi oleh negara dan dengan mudah di bobol, maka pemilu 2024 berpotensi kecurangan..'"
Pemilihan Umum Serentak Pemilu Tahun 2024 Masehi,b'untuk apa pemilu kpps dalam'
Alis,b'RT @Valosenadya1: Para PLT ini tak diragukan lagi adalah \xe2\x80\x9cmesin uang\xe2\x80\x9d rezim oligarki utk hadapi Pemilu Nasional 2024.\n\nKepanjangan tangan k\xe2\x80\xa6'
Satriyo Piningit,"b'RT @alisyarief: Ketum Muhammadiyah: Negara Jangan Ikut Terlibat Kontestasi Pemilu 2024, Sindir Siapa? https://t.co/qMxGqR1XN1'"
kuncoro,b'@YanHarahap Harap maklum 2024 Masi lama.. mgkin mendekati pemilu baru mau dtg utk cari muka dan sok merakyat peduli wong cilik..\xf0\x9f\x98\x82\xf0\x9f\x98\x82'
JRK Aceh,b'KIP Aceh Timur Tuntaskan Verifikasi Faktual Parpol Peserta Pemilu 2024 https://t.co/byE1vtGiln https://t.co/5ALuhd4CxF'
Puan Speaker Dewan,"b'Secara dekade, partai BN sudah pun memerintah negara sejak malaya merdeka bahkan waktu malaysia dibentuk 1963 juga, BN belum pernah kalah di dalam pemilu. Sehinggalah tsunami politik berlaku pada tahun 2018 dimana pembangkang berhasil menang di dalam pemilu tersebut'"
Atha,b'RT @Mentimoen: Hasil pemilu midterm memperlihatkan Biden akan menjadi presiden dengan tangan kaki terikat. Biden sudah menyatakan tidak ada\xe2\x80\xa6'
Apoy,b'Pemilu masih jauh orang2sudah pada lataah membuat janji biar bisa jadi yg no satu di negri ini g peduli jadi Sengkuni asalkan punya kursi orang pintar terkadang suka bertingkah aneh yg peting jadi penguasa rela kehilangan harga dirinya'
Keadilan Sosial...,b'RT @keuangannews_id: Pemerhati Politik dan Sosial: Kecurangan Pemilu Diawali dari Rilis Lembaga Survei dan\xc2\xa0Buzzer! https://t.co/oeyilOf3HW'
GenPI.co,b'Sebanyak 4 kursi di DPRD Kapuas Hulu menjadi incaran Partai Keadilan Sejahtera (PKS) Kabupaten Kapuas Hulu pada Pemilu 2024. #Pemilu2024 https://t.co/1hQReFcLzj'
Harakiri,b'RT @detikcom: Kader Demokrat mengungkit perubahan di Hari Pahlawan ini. Mereka menyamakan Anies-AHY dilengkapi dengan Aher seperti trio Suk\xe2\x80\xa6'
Pejabat Sementara 🧐🤫,"b'RT @papa_loren: PSI Belum Penuhi Syarat Pemilu 2024. Sedih jg ya klo sampe ngga LOLOS, ntar nyari yg lucu dimana? \xf0\x9f\x99\x88 https://t.co/XjgUyGTFhw'"
Juan,b'RT @detikcom: Kader Demokrat mengungkit perubahan di Hari Pahlawan ini. Mereka menyamakan Anies-AHY dilengkapi dengan Aher seperti trio Suk\xe2\x80\xa6'
Ketupat,"b'RT @papa_loren: PSI Belum Penuhi Syarat Pemilu 2024. Sedih jg ya klo sampe ngga LOLOS, ntar nyari yg lucu dimana? \xf0\x9f\x99\x88 https://t.co/XjgUyGTFhw'"
YoezZar,"b'@Heraloebss Tapi aku ingat dulu waktu Paripurna UU. Pemilu/Pilpres tahun 2018, FZ ini sebagai Pimpinan Sidang DPR RI, lompat meja menyatakan Walk Out saat akan diadakan Voting \xf0\x9f\x91\x8d\xf0\x9f\x87\xae\xf0\x9f\x87\xa9\xf0\x9f\x91\x8d'"
niana TREASURE IS 12‼️,"b'nanti 2024 pertama kalinya aku bakal ikut pemilu presiden, hmmm siapa mau dicoblos\xf0\x9f\xa4\xa9 https://t.co/UQrWWGJ6CR'"
Mas Bro,"b'RT @f_fathur: Kebodohan BuzzerRp mempermasalahkan Koalisinya Anies !! \nGw jelasin yah, Cerdas dikit daripada bilang Koalisi Mangkrak! \nPeng\xe2\x80\xa6'"
AROM 2,b'@rapuunzeI TAPI NGGA KAYA PEMILU JEN'
darth_conscious,b'@TirtoID mau pemilu?'
"JENEL KCIL, WAJENDRA",b'Layoutnya ga kaya lagi pemilu kan?'
olivia vennya,b'full senyum hari ini dapet 2.5jt wkwkwk makasih efek pemilu US'
#SoeDADANG PRESIDENT,"b'@fadlizon @jokowi @prabowo Hahahaha.. ternyata Hubertus @jokowi jadi Presiden bukan karena hasil pemilu, melainkan dapat jatah dari #KapitalismeGlobalChina, saya minta agar Uncle @JoeBiden selamatkan demokrasi...\nCc @KetumProDEMnew #ProDEM'"
Dewasuri,b'RT @ShamsiAli2: https://t.co/Se7Kz47zv3'
F_Fathur (journalist) F3 Strategic,"b'Kebodohan BuzzerRp mempermasalahkan Koalisinya Anies !! \nGw jelasin yah, Cerdas dikit daripada bilang Koalisi Mangkrak! \nPengesahan Partai Perserta Pemilu itu tgl 14/12/2022, Gimana mau Deklarasi Koalisi klw belum sah sbg Peserta Pemilu?\nJgn Bego diborong walau gratis ya bong!!! https://t.co/Rfe7ffqtXA'"
gis!,"b'1-2 minggu ini bener2 kerasa bgt atmosfir kampusnya gegara pemilu BEM Fakultas + Univ. \nThen skrg lagi di lounge lihat anak S1 lagi pda rapat lewat zoom, baru mulai jam 1 wkwk..\n\n\xec\x95\x94\xed\x8a\xbc \xea\xb7\xb8 \xec\x8b\x9c\xea\xb8\xb0 \xea\xb7\xb8\xeb\xa6\xac\xec\x9a\xb8\xea\xb1\xb0\xec\x95\xbc~~'"
Kopi,b'RT @Panca126: @Tita83079013 @NasDem Lagian... Sok PD pemilu masih jauh sudah coba2 Bikin heboh ngajuin capres.. Parah nya yang diajukan Ora\xe2\x80\xa6'
SINPO ID,"b'Pemilu 2024, Komnas HAM Ingatkan Hak Kesehatan Penyelenggara https://t.co/6F0jObPkDN'"
Suardipur,b'RT @keuangannews_id: Pemerhati Politik dan Sosial: Kecurangan Pemilu Diawali dari Rilis Lembaga Survei dan\xc2\xa0Buzzer! https://t.co/oeyilOf3HW'
Joko suyoto,b'@HelmiFelis_ https://t.co/qxAFYwcSfD https://t.co/e39BRsW75B'
oykzch,b'RT @msaid_didu: Peta jalan perpanjangan masa jabatan Presiden sdh disiapkan sbb :\n1) jangan buru2 putuskan calon\n2) kumpulkan relawan\n3) bu\xe2\x80\xa6'
telisik malam,"b'Artinya ga apa-apa dong cawapres dari PKS, bukan dr demokrat... demi menjaga kesolidan... daripada buka sebelum maghrib...\n\nhttps://t.co/ilF24wHoGw\n\nDemokrat mengaku tak khawatir PKS digoda koalisi lain. Menurutnya, saat ini Koalisi Perubahan sangat solid satu sama lain.'"
My Putun,"b'Jawab NasDem, Fahri Hamzah Bakal Terus Kritik Capres Nominasi Kasar Elite https://t.co/efjGtOil4X'"
liza 🥐🥨🍵,b'partai yang masuk pemilu 2024 :D https://t.co/6h1SfK711q https://t.co/QXjUgDbAMo'
Pemilihan Umum Serentak Pemilu Tahun 2024 Masehi,b'untuk apa pemilu kemerdekaan'
Xela,b'Dikuasi bandar.\n\nDi 2019 yg 500 M ngak dari bandar kah.\nGerombolan munafik... https://t.co/3995hxvf7e'
𝑶𝒍𝒅-𝒇𝒂𝒔𝒉𝒊𝒐𝒏𝒆𝒅𝒍𝒚 𝑫𝒆𝒘𝒊,b'RT @PDI_Perjuangan: PDI Perjuangan Siap Kembali Dipercaya Rakyat\n\nKerja Kerakyatan dan Konsolidasi Internal Kunci Kemenangan Pemilu 2024 ht\xe2\x80\xa6'
Nusi_da,"b'RT @Syarman59: Sudah diduga, buru2 deklarasi Capres oleh @NasDem hanya untuk mengganggu @KPK_RI melanjutkan kasus formula e ke tingkat peny\xe2\x80\xa6'"
Yudo,b'@M45Broo Kendaraan saat pemilu saja'
Fikri Ramadhan,b'RT @rhmardika: Sementara rakyat di bawah dalam konflik struktural versus bisnis ekstraktif yang dipayungi oleh elit lokal dan aparatus koru\xe2\x80\xa6'
Enggang Borneo,"b'@mahasiswigenz Nasdem lupa pepatah ""Suara Rakyat Suara Tuhan"" waktu Pemilu\xf0\x9f\xa4\xa3\xf0\x9f\xa4\xa3\xf0\x9f\xa4\xa3 Rakyat mau di bohongi sama Nasdem \xf0\x9f\xa4\xa3\xf0\x9f\xa4\xa3\xf0\x9f\xa4\xa3\xf0\x9f\xa4\xa3'"
